{
  "files": [
    {
      "domains": [
        "daily-hygiene",
        "routing"
      ],
      "lines": 153,
      "path": "SKILL.md",
      "read_when": [
        "checking active workflow routing",
        "starting broad training or export work"
      ],
      "role": "active skill entrypoint and routing workflow",
      "sha256": "9f38dde56c08ce2eb0cf475cb239a91801e6284df970807b763ea0215a20b766",
      "words": 1339
    },
    {
      "domains": [
        "daily-hygiene",
        "routing"
      ],
      "lines": 29,
      "path": "references/HYGIENE_QUICK.md",
      "read_when": [
        "ordinary code review, cleanup, hardening, or implementation"
      ],
      "role": "daily hygiene checklist",
      "sha256": "36c006bd157c8a6793785dd7151d4c006573ed6e346b36126fa17e3a9da0e9b3",
      "words": 350
    },
    {
      "domains": [
        "evidence",
        "guardrails",
        "promotion",
        "training",
        "verification"
      ],
      "lines": 90,
      "path": "references/PASS-100.md",
      "read_when": [
        "scoring or evaluating candidate work"
      ],
      "role": "PASS-100 scoring rubric",
      "sha256": "8267ad5546dd64b301be3a0cf1a54ca340d429662147a91be45321e57aad6362",
      "words": 700
    },
    {
      "domains": [
        "guardrails",
        "promotion",
        "training"
      ],
      "lines": 98,
      "path": "references/compound-loop.md",
      "read_when": [
        "changing training, promotion, or compounding behavior"
      ],
      "role": "training and promotion protocol",
      "sha256": "897f5b89d885ec65b33c24985300ac2b200451d25e6b3097d94b73718901a3c8",
      "words": 1025
    },
    {
      "domains": [
        "reference"
      ],
      "lines": 71,
      "path": "references/context-index.schema.json",
      "read_when": [
        "the task directly names this file or domain"
      ],
      "role": "reference material",
      "sha256": "cca04833b27a0cf168443523cbae63db813dd55cd1fa51ca448d84092f58f39c",
      "words": 115
    },
    {
      "domains": [
        "fixtures",
        "matrix"
      ],
      "lines": 133,
      "path": "references/eval-prompts.md",
      "read_when": [
        "selecting PASS-100 prompts or checking fixture coverage"
      ],
      "role": "PASS-100 prompt suite",
      "sha256": "0f57123065a6b5848c44ce8701e3b4c6ad10acb0c048447c84962775fe06cf3e",
      "words": 1261
    },
    {
      "domains": [
        "evidence",
        "verification"
      ],
      "lines": 36,
      "path": "references/evidence-report.md",
      "read_when": [
        "claiming completion",
        "recording verification evidence"
      ],
      "role": "completion and verification report shape",
      "sha256": "fd7fe7b276ab27341334549b32322c17fbc5f5aedf794523b3d5fcf708c5c44b",
      "words": 322
    },
    {
      "domains": [
        "daily-hygiene",
        "routing"
      ],
      "lines": 78,
      "path": "references/hygiene-principles.md",
      "read_when": [
        "the task directly names this file or domain"
      ],
      "role": "distilled operational principles",
      "sha256": "39b924473d31d72aba1f04e892824862664c449e1fc20104ec0519cdf0eb53a7",
      "words": 989
    },
    {
      "domains": [
        "guardrails",
        "promotion",
        "training"
      ],
      "lines": 36,
      "path": "references/overtraining-guardrails.md",
      "read_when": [
        "adding lessons, fixtures, sources, or training rules"
      ],
      "role": "anti-overtraining checks",
      "sha256": "23b3a67de8fece943363123e0f8aa2a5346dddae5e723a6ae97a39707439519d",
      "words": 332
    },
    {
      "domains": [
        "reference"
      ],
      "lines": 39,
      "path": "references/principle-traceability.md",
      "read_when": [
        "the task directly names this file or domain"
      ],
      "role": "reference material",
      "sha256": "0f6a64398bdac0d9910ab4eaf7005c3d90169e4d315588476abe9d0b28d644e9",
      "words": 738
    },
    {
      "domains": [
        "reference"
      ],
      "lines": 37,
      "path": "references/research-canon.md",
      "read_when": [
        "the task directly names this file or domain"
      ],
      "role": "research basis summary",
      "sha256": "50646cd691823672a539040c9e82126db143c41e98d242c6ea18ffde7b71944e",
      "words": 376
    },
    {
      "domains": [
        "audit",
        "source"
      ],
      "lines": 61,
      "path": "references/source-grounded-honing.md",
      "read_when": [
        "the task directly names this file or domain"
      ],
      "role": "reference material",
      "sha256": "00596b033bb94985e3b9556c66bb7560628662f4330bbaf10ad657a35e379a46",
      "words": 374
    },
    {
      "domains": [
        "audit",
        "source"
      ],
      "lines": 24,
      "path": "references/source-packs/agent-eval-methodology.md",
      "read_when": [
        "performing source-grounded scoring or honing"
      ],
      "role": "distilled source pack",
      "sha256": "c40a8c0a62767f199c8426f6f45cd310044be2303b6c91ae225d879b50e604a8",
      "words": 193
    },
    {
      "domains": [
        "audit",
        "source"
      ],
      "lines": 17,
      "path": "references/source-packs/cisa-secure-by-design.md",
      "read_when": [
        "performing source-grounded scoring or honing"
      ],
      "role": "distilled source pack",
      "sha256": "4fb69381fecac7937027dfbb998f4dae11944973c2c56299f300c5b5b19914ff",
      "words": 80
    },
    {
      "domains": [
        "audit",
        "source"
      ],
      "lines": 22,
      "path": "references/source-packs/google-developer-docs-style.md",
      "read_when": [
        "performing source-grounded scoring or honing"
      ],
      "role": "distilled source pack",
      "sha256": "97ddabee7164318cae55658db4c53899f8a872db1cb113f22853ab11f549ae0b",
      "words": 206
    },
    {
      "domains": [
        "audit",
        "source"
      ],
      "lines": 27,
      "path": "references/source-packs/google-eng-practices.md",
      "read_when": [
        "performing source-grounded scoring or honing"
      ],
      "role": "distilled source pack",
      "sha256": "525b6a272998e3447782821cc376c9f1816459e71a4d471a0d280a28257cb19f",
      "words": 194
    },
    {
      "domains": [
        "audit",
        "source"
      ],
      "lines": 16,
      "path": "references/source-packs/google-style-guides.md",
      "read_when": [
        "performing source-grounded scoring or honing"
      ],
      "role": "distilled source pack",
      "sha256": "9304a823462adb44fbb38b2f0fee16ab0973ab98bea35133d97acb6014d5134c",
      "words": 80
    },
    {
      "domains": [
        "audit",
        "source"
      ],
      "lines": 18,
      "path": "references/source-packs/google-testing.md",
      "read_when": [
        "performing source-grounded scoring or honing"
      ],
      "role": "distilled source pack",
      "sha256": "c61b37df512d4f16f6e7e3605983dbbf7ff7f4e0787588bfbff9550b5a679786",
      "words": 92
    },
    {
      "domains": [
        "audit",
        "source"
      ],
      "lines": 27,
      "path": "references/source-packs/llm-provider-schema-docs.md",
      "read_when": [
        "performing source-grounded scoring or honing"
      ],
      "role": "distilled source pack",
      "sha256": "595a21c34a1af909db03c1f30926ffc36d3ac9541af34dbacd75d25845eae9bf",
      "words": 281
    },
    {
      "domains": [
        "audit",
        "source"
      ],
      "lines": 17,
      "path": "references/source-packs/microsoft-rest-api-guidelines.md",
      "read_when": [
        "performing source-grounded scoring or honing"
      ],
      "role": "distilled source pack",
      "sha256": "854908ba489b2d94beb4accc6944682063ec61cf932c48e30b75ef3bfee163b0",
      "words": 80
    },
    {
      "domains": [
        "audit",
        "source"
      ],
      "lines": 17,
      "path": "references/source-packs/microsoft-sdl.md",
      "read_when": [
        "performing source-grounded scoring or honing"
      ],
      "role": "distilled source pack",
      "sha256": "c309525b1767de4072254cbeeacc8d16e9bbf9584efee16d46d63a29c8c11d8c",
      "words": 85
    },
    {
      "domains": [
        "audit",
        "source"
      ],
      "lines": 17,
      "path": "references/source-packs/mitre-cwe-top25.md",
      "read_when": [
        "performing source-grounded scoring or honing"
      ],
      "role": "distilled source pack",
      "sha256": "cdbe6b32cf12547f4942a797905e71a5cb7da210b80060fbd04c05c34ab356cc",
      "words": 101
    },
    {
      "domains": [
        "audit",
        "source"
      ],
      "lines": 19,
      "path": "references/source-packs/nasa-jpl-power-of-ten.md",
      "read_when": [
        "performing source-grounded scoring or honing"
      ],
      "role": "distilled source pack",
      "sha256": "d5b92db2775a5c09bf8fa7eb41cb26705e7d499d806063b9c0c52b21d20ec3cc",
      "words": 108
    },
    {
      "domains": [
        "audit",
        "source"
      ],
      "lines": 18,
      "path": "references/source-packs/nist-ssdf.md",
      "read_when": [
        "performing source-grounded scoring or honing"
      ],
      "role": "distilled source pack",
      "sha256": "efb070657006a5f716138e19cc31e472684c189475dafae37e47863d2a16aee3",
      "words": 99
    },
    {
      "domains": [
        "audit",
        "source"
      ],
      "lines": 16,
      "path": "references/source-packs/openssf-scorecard.md",
      "read_when": [
        "performing source-grounded scoring or honing"
      ],
      "role": "distilled source pack",
      "sha256": "727c4d64e493291f8e4a7b94e1e229ac6fd11324ef00cc22e74cae63f43b94e6",
      "words": 79
    },
    {
      "domains": [
        "audit",
        "source"
      ],
      "lines": 17,
      "path": "references/source-packs/opentelemetry.md",
      "read_when": [
        "performing source-grounded scoring or honing"
      ],
      "role": "distilled source pack",